{
  "$id": "https://jeremyosborne.com/dnpk/army.schema.json",
  "$schema": "http://json-schema.org/draft-07/schema#",
  "title": "army",
  "type": "object",
  "description": "Defines a distinct army type, from which single entity instances are generated in game.",
  "properties": {
    "documentation": {
      "description": "Human friendly documentation that can be stored with the (human unfriendly) JSON. For optimized systems, this attribute should be pruned at run time.",
      "type": "string"
    },
    "equipment": {
      "default": [],
      "description": "Inventory carried by the unit.",
      "items": {
        "$ref": "https://jeremyosborne.com/dnpk/equippable.schema.json"
      },
      "type": "array"
    },
    "health": {
      "default": 2,
      "description": "The base number of successful attacks any instance of this unit type can suffer before dying.",
      "type": "integer"
    },
    "id": {
      "description": "Unique id for a particular instance of this type.",
      "type": "string"
    },
    "effects": {
      "default": [],
      "description": "Longer term effects inflicted on this specific unit instance beyond birth.",
      "items": {
        "$ref": "https://jeremyosborne.com/dnpk/effect.schema.json"
      },
      "type": "array"
    },
    "movementSpeed": {
      "description": "The number of squares per turn this unit can move over ideal terrain.",
      "type": "integer"
    },
    "name": {
      "description": "Descriptive, display name for this type of army.",
      "examples": [
        "Heavy Infantry",
        "Light Infantry"
      ],
      "type": "string"
    },
    "nameInstance": {
      "description": "Unique name for the unit",
      "examples": [
        "Vorgoth the Timid, Destroyer of Lint Bunnies"
      ],
      "type": "string"
    },
    "strength": {
      "description": "Base, unmodified attack/defense strength of the unit.",
      "type": "integer"
    },
    "type": {
      "enum": ["army"],
      "default": "army",
      "description": "duck typing",
      "type": "string"
    }
  }
}
