{
  "health": 2,
  "effects": [
    {
      "name": "brawn-terrain-modifier",
      "magnitude": -1,
      "metadata": {
        "name": "forest"
      }
    },
    {
      "name": "brawn-terrain-modifier",
      "magnitude": 1,
      "metadata": {
        "name": "hill"
      }
    }
  ],
  "movementSpeed": 9,
  "name": "mountaineer",
  "strength": 5
}
