{
  "health": 2,
  "effects": [
    {
      "name": "terrain-modifier-brawn",
      "magnitude": -1,
      "metadata": {
        "name": "forest"
      }
    },
    {
      "name": "terrain-modifier-brawn",
      "magnitude": -1,
      "metadata": {
        "name": "hill"
      }
    }
  ],
  "movementSpeed": 14,
  "name": "wolf-rider",
  "strength": 5
}
