{
  "health": 2,
  "effects": [
    {
      "name": "terrain-battle-modifier",
      "magnitude": 1,
      "metadata": {
        "name": "forest"
      }
    },
    {
      "name": "terrain-battle-modifier",
      "magnitude": -1,
      "metadata": {
        "name": "hill"
      }
    },
    {
      "name": "terrain-battle-modifier",
      "magnitude": -1,
      "metadata": {
        "name": "marsh"
      }
    }
  ],
  "movementSpeed": 12,
  "name": "elven-archer",
  "strength": 4
}
