{
  "health": 2,
  "effects": [
    {
      "name": "brawn-terrain-modifier",
      "magnitude": -1,
      "metadata": {
        "name": "forest"
      }
    },
    {
      "name": "brawn-terrain-modifier",
      "magnitude": -1,
      "metadata": {
        "name": "hill"
      }
    },
    {
      "name": "brawn-terrain-modifier",
      "magnitude": -1,
      "metadata": {
        "name": "marsh"
      }
    }
  ],
  "movementSpeed": 18,
  "name": "cavalry",
  "strength": 6
}
