{
  "health": 2,
  "effects": [
    {
      "name": "brawn-terrain-modifier",
      "magnitude": 1,
      "metadata": {
        "appliesTo": "forest"
      }
    },
    {
      "name": "brawn-terrain-modifier",
      "magnitude": -1,
      "metadata": {
        "appliesTo": "hill"
      }
    },
    {
      "name": "brawn-terrain-modifier",
      "magnitude": -1,
      "metadata": {
        "appliesTo": "marsh"
      }
    }
  ],
  "movementSpeed": 12,
  "name": "ranger",
  "strength": 4
}
