{
  "health": 2,
  "effects": [
    {
      "name": "elite"
    },
    {
      "name": "brawn-terrain-modifier",
      "magnitude": -1,
      "metadata": {
        "name": "forest"
      }
    },
    {
      "name": "brawn-terrain-modifier",
      "magnitude": 1,
      "metadata": {
        "name": "marsh"
      }
    }
  ],
  "movementSpeed": 12,
  "name": "undead",
  "strength": 6
}
